{
  "$schema": "https://json-schema.org/draft/2020-12/schema",
  "$id": "https://github.com/vassiliylakhonin/agenda-intelligence-md/schemas/v1/critical-minerals-due-diligence-response.schema.json",
  "title": "CriticalMineralsDueDiligenceResponse",
  "description": "Deterministic mineral dossier documentary coverage, source-quality issues, stage-specific owner actions and human-review routing. Caller-supplied records are not independently authenticated; no legal or business risk clearance is established.",
  "x-schema-version": "1",
  "type": "object",
  "additionalProperties": false,
  "required": [
    "triage_recommendation",
    "risk_signal",
    "decision_readiness_score",
    "decision_readiness_label",
    "operational_decision",
    "commodity",
    "origin_jurisdiction",
    "traceability_status",
    "supplied_sources",
    "minimum_sources_before_go",
    "evidence_gaps",
    "watch_next",
    "human_review_required",
    "not_advice_notice"
  ],
  "properties": {
    "triage_recommendation": {
      "type": "string",
      "enum": [
        "not_decision_ready",
        "escalate_before_offtake",
        "escalate_before_shipment",
        "escalate_before_investment",
        "ready_for_human_review",
        "insufficient_information"
      ]
    },
    "risk_signal": {
      "type": "string",
      "enum": [
        "low",
        "medium",
        "medium_high",
        "high",
        "unknown"
      ]
    },
    "decision_readiness_score": {
      "type": "integer",
      "minimum": 0,
      "maximum": 100
    },
    "decision_readiness_label": {
      "type": "string",
      "enum": [
        "insufficient_information",
        "not_decision_ready",
        "partial",
        "review_ready"
      ]
    },
    "operational_decision": {
      "type": "object",
      "required": [
        "decision",
        "reason_code",
        "blocking_gaps"
      ],
      "additionalProperties": false,
      "properties": {
        "decision": {
          "type": "string",
          "enum": [
            "stop",
            "request_evidence",
            "require_approval",
            "continue"
          ]
        },
        "reason_code": {
          "type": "string"
        },
        "blocking_gaps": {
          "type": "array",
          "items": {
            "type": "string"
          }
        },
        "next_permitted_action": {
          "type": "string"
        }
      }
    },
    "commodity": {
      "type": "string"
    },
    "origin_jurisdiction": {
      "type": "string"
    },
    "processing_jurisdiction": {
      "type": "string"
    },
    "target_market": {
      "type": "string"
    },
    "traceability_status": {
      "type": "string",
      "enum": [
        "verified",
        "partial",
        "unverified",
        "obfuscated"
      ],
      "description": "Caller-supplied documentary coverage only. This service never independently verifies origin."
    },
    "export_control_exposure": {
      "type": "object",
      "required": [
        "quota_restricted",
        "jurisdiction_risk_flags"
      ],
      "additionalProperties": false,
      "properties": {
        "quota_restricted": {
          "type": "boolean",
          "description": "Legacy field: false means no restriction established by this linter, not legal clearance. Consult applicability questions."
        },
        "processing_monopoly_risk": {
          "type": "boolean"
        },
        "jurisdiction_risk_flags": {
          "type": "array",
          "items": {
            "type": "string"
          }
        }
      }
    },
    "supplied_sources": {
      "type": "array",
      "items": {
        "type": "string"
      }
    },
    "minimum_sources_before_go": {
      "type": "array",
      "items": {
        "type": "string"
      }
    },
    "evidence_gaps": {
      "type": "array",
      "items": {
        "type": "string"
      }
    },
    "top_risks": {
      "type": "array",
      "items": {
        "type": "object",
        "required": [
          "category",
          "severity",
          "description"
        ],
        "additionalProperties": false,
        "properties": {
          "category": {
            "type": "string"
          },
          "severity": {
            "type": "string",
            "enum": [
              "high",
              "medium",
              "low"
            ]
          },
          "description": {
            "type": "string"
          }
        }
      }
    },
    "exposure_layers": {
      "type": "array",
      "items": {
        "type": "object",
        "required": [
          "layer",
          "level",
          "summary"
        ],
        "additionalProperties": false,
        "properties": {
          "layer": {
            "type": "string"
          },
          "level": {
            "type": "string"
          },
          "summary": {
            "type": "string"
          }
        }
      }
    },
    "watch_next": {
      "type": "array",
      "items": {
        "type": "string"
      }
    },
    "human_review_required": {
      "type": "boolean"
    },
    "not_advice_notice": {
      "type": "string"
    },
    "readiness_contract": {
      "$ref": "#/$defs/readiness_contract"
    },
    "run_provenance": {
      "type": "object",
      "required": [
        "contract_version",
        "input_digest",
        "schema_uri"
      ],
      "additionalProperties": false,
      "properties": {
        "contract_version": {
          "type": "string"
        },
        "input_digest": {
          "type": "string"
        },
        "schema_uri": {
          "type": "string"
        }
      }
    },
    "dossier_review": {
      "type": "object",
      "additionalProperties": false,
      "required": [
        "policy_version",
        "assessment_date",
        "eligible_source_types",
        "source_reviews",
        "owner_actions",
        "applicability_questions",
        "limitations"
      ],
      "properties": {
        "policy_version": {
          "type": "string"
        },
        "assessment_date": {
          "type": [
            "string",
            "null"
          ]
        },
        "eligible_source_types": {
          "type": "array",
          "items": {
            "type": "string"
          }
        },
        "source_reviews": {
          "type": "array",
          "items": {
            "type": "object",
            "additionalProperties": false,
            "required": [
              "source_ref",
              "source_type",
              "status",
              "issues"
            ],
            "properties": {
              "source_ref": {
                "type": "string"
              },
              "source_type": {
                "type": "string"
              },
              "status": {
                "enum": [
                  "eligible_for_review",
                  "needs_evidence"
                ]
              },
              "issues": {
                "type": "array",
                "items": {
                  "type": "string"
                }
              }
            }
          }
        },
        "owner_actions": {
          "type": "array",
          "items": {
            "type": "object",
            "additionalProperties": false,
            "required": [
              "source_type",
              "owner",
              "priority",
              "action"
            ],
            "properties": {
              "source_type": {
                "type": "string"
              },
              "owner": {
                "type": "string"
              },
              "priority": {
                "enum": [
                  "before_decision"
                ]
              },
              "action": {
                "type": "string"
              }
            }
          }
        },
        "applicability_questions": {
          "type": "array",
          "items": {
            "type": "string"
          }
        },
        "limitations": {
          "type": "array",
          "items": {
            "type": "string"
          }
        }
      }
    },
    "next_action": {
      "type": "string",
      "enum": [
        "block",
        "review",
        "insufficient"
      ]
    },
    "decision_kind": {
      "const": "evidence_review"
    },
    "authorization_granted": {
      "const": false
    },
    "score_kind": {
      "type": "string",
      "enum": [
        "risk",
        "evidence_readiness",
        "not_scored"
      ]
    }
  },
  "$defs": {
    "readiness_named_value": {
      "type": "object",
      "additionalProperties": false,
      "required": [
        "field",
        "value"
      ],
      "properties": {
        "field": {
          "type": "string",
          "minLength": 1
        },
        "value": {
          "type": "string",
          "minLength": 1
        }
      }
    },
    "readiness_contract": {
      "type": "object",
      "additionalProperties": false,
      "description": "Additive normalized readiness view for cross-profile human-review routing.",
      "required": [
        "profile",
        "status",
        "score",
        "routing",
        "signal",
        "blocking_gaps",
        "non_blocking_gaps",
        "claim_audit",
        "owner_actions",
        "watch_next",
        "human_review_required",
        "boundary_notice"
      ],
      "properties": {
        "profile": {
          "type": "string",
          "minLength": 1
        },
        "status": {
          "type": "string",
          "minLength": 1
        },
        "score": {
          "type": [
            "integer",
            "null"
          ],
          "minimum": 0,
          "maximum": 100
        },
        "routing": {
          "anyOf": [
            {
              "$ref": "#/$defs/readiness_named_value"
            },
            {
              "type": "null"
            }
          ]
        },
        "signal": {
          "anyOf": [
            {
              "$ref": "#/$defs/readiness_named_value"
            },
            {
              "type": "null"
            }
          ]
        },
        "blocking_gaps": {
          "type": "array",
          "items": {}
        },
        "non_blocking_gaps": {
          "type": "array",
          "items": {}
        },
        "claim_audit": {
          "type": "array",
          "items": {}
        },
        "owner_actions": {
          "type": "array",
          "items": {}
        },
        "watch_next": {
          "type": "array",
          "items": {
            "type": "string",
            "minLength": 1
          }
        },
        "human_review_required": {
          "type": "boolean"
        },
        "boundary_notice": {
          "type": "string",
          "minLength": 1
        }
      }
    }
  }
}
