{
  "triage_recommendation": "insufficient_information",
  "risk_signal": "unknown",
  "decision_readiness_score": 0,
  "decision_readiness_label": "insufficient_information",
  "operational_decision": {
    "decision": "request_evidence",
    "reason_code": "critical_evidence_gaps",
    "blocking_gaps": [
      "Missing reviewable source: mining concession or license extract",
      "Missing reviewable source: certified ore assay report",
      "Missing reviewable source: beneficial ownership due diligence",
      "Missing reviewable source: export quota and permit clearance",
      "Missing reviewable source: responsible sourcing due diligence",
      "Missing reviewable source: processing and refining tolling agreement",
      "Missing reviewable source: chain of custody records",
      "Missing reviewable source: regulatory applicability memo"
    ],
    "next_permitted_action": "Resolve dossier_review.owner_actions before decision; document labels do not establish readiness"
  },
  "commodity": "copper",
  "origin_jurisdiction": "Kazakhstan",
  "traceability_status": "unverified",
  "export_control_exposure": {
    "quota_restricted": false,
    "processing_monopoly_risk": false,
    "jurisdiction_risk_flags": []
  },
  "supplied_sources": [
    "mining_concession_or_license_extract",
    "certified_ore_assay_report",
    "beneficial_ownership_due_diligence",
    "export_quota_and_permit_clearance",
    "responsible_sourcing_due_diligence",
    "processing_and_refining_tolling_agreement",
    "chain_of_custody_records",
    "regulatory_applicability_memo"
  ],
  "minimum_sources_before_go": [
    "mining_concession_or_license_extract",
    "certified_ore_assay_report",
    "beneficial_ownership_due_diligence",
    "export_quota_and_permit_clearance",
    "responsible_sourcing_due_diligence",
    "processing_and_refining_tolling_agreement",
    "chain_of_custody_records",
    "regulatory_applicability_memo"
  ],
  "evidence_gaps": [
    "Missing reviewable source: mining concession or license extract",
    "Missing reviewable source: certified ore assay report",
    "Missing reviewable source: beneficial ownership due diligence",
    "Missing reviewable source: export quota and permit clearance",
    "Missing reviewable source: responsible sourcing due diligence",
    "Missing reviewable source: processing and refining tolling agreement",
    "Missing reviewable source: chain of custody records",
    "Missing reviewable source: regulatory applicability memo"
  ],
  "top_risks": [
    {
      "category": "Dossier Traceability Coverage",
      "severity": "high",
      "description": "Caller-supplied documentary traceability status is unverified for copper originating from Kazakhstan."
    }
  ],
  "exposure_layers": [
    {
      "layer": "mining_concession_or_license_extract",
      "level": "needs_evidence",
      "summary": "Illustrative or placeholder material is not documentary evidence."
    },
    {
      "layer": "certified_ore_assay_report",
      "level": "needs_evidence",
      "summary": "Illustrative or placeholder material is not documentary evidence."
    },
    {
      "layer": "beneficial_ownership_due_diligence",
      "level": "needs_evidence",
      "summary": "Illustrative or placeholder material is not documentary evidence."
    },
    {
      "layer": "export_quota_and_permit_clearance",
      "level": "needs_evidence",
      "summary": "Illustrative or placeholder material is not documentary evidence."
    },
    {
      "layer": "responsible_sourcing_due_diligence",
      "level": "needs_evidence",
      "summary": "Illustrative or placeholder material is not documentary evidence."
    },
    {
      "layer": "processing_and_refining_tolling_agreement",
      "level": "needs_evidence",
      "summary": "Illustrative or placeholder material is not documentary evidence."
    },
    {
      "layer": "chain_of_custody_records",
      "level": "needs_evidence",
      "summary": "Illustrative or placeholder material is not documentary evidence."
    },
    {
      "layer": "regulatory_applicability_memo",
      "level": "needs_evidence",
      "summary": "Illustrative or placeholder material is not documentary evidence."
    }
  ],
  "watch_next": [
    "Confirm commodity form/grade, end use, shipment date, customs code and transit jurisdictions before assessing restrictions.",
    "Ask counsel to establish applicable permits and sanctions rules; a commodity or country label does not establish a prohibition.",
    "Determine CSDDD scope, dates and company thresholds; a responsible-sourcing audit is not CSDDD certification."
  ],
  "human_review_required": true,
  "not_advice_notice": "Pre-compliance evidence triage only on caller-supplied documentation. Does not perform live retrieval, factual-truth verification, mineral assay testing, or provide legal, sanctions, trade-compliance, ESG certification, or investment advice.",
  "run_provenance": {
    "contract_version": "1.17.0",
    "input_digest": "sha256:f751a0a64252ff53191501c83829a240d4364379381d0f032a8e99e72ee0aef8",
    "schema_uri": "https://github.com/vassiliylakhonin/agenda-intelligence-md/schemas/v1/critical-minerals-due-diligence-response.schema.json"
  },
  "processing_jurisdiction": "Kazakhstan",
  "target_market": "eu",
  "dossier_review": {
    "policy_version": "mineral-dossier.v2",
    "assessment_date": "2026-10-05",
    "eligible_source_types": [],
    "source_reviews": [
      {
        "source_ref": "supplied_sources[0]",
        "source_type": "mining_concession_or_license_extract",
        "status": "needs_evidence",
        "issues": [
          "Illustrative or placeholder material is not documentary evidence."
        ]
      },
      {
        "source_ref": "supplied_sources[1]",
        "source_type": "certified_ore_assay_report",
        "status": "needs_evidence",
        "issues": [
          "Illustrative or placeholder material is not documentary evidence."
        ]
      },
      {
        "source_ref": "supplied_sources[2]",
        "source_type": "beneficial_ownership_due_diligence",
        "status": "needs_evidence",
        "issues": [
          "Illustrative or placeholder material is not documentary evidence."
        ]
      },
      {
        "source_ref": "supplied_sources[3]",
        "source_type": "export_quota_and_permit_clearance",
        "status": "needs_evidence",
        "issues": [
          "Illustrative or placeholder material is not documentary evidence."
        ]
      },
      {
        "source_ref": "supplied_sources[4]",
        "source_type": "responsible_sourcing_due_diligence",
        "status": "needs_evidence",
        "issues": [
          "Illustrative or placeholder material is not documentary evidence."
        ]
      },
      {
        "source_ref": "supplied_sources[5]",
        "source_type": "processing_and_refining_tolling_agreement",
        "status": "needs_evidence",
        "issues": [
          "Illustrative or placeholder material is not documentary evidence."
        ]
      },
      {
        "source_ref": "supplied_sources[6]",
        "source_type": "chain_of_custody_records",
        "status": "needs_evidence",
        "issues": [
          "Illustrative or placeholder material is not documentary evidence."
        ]
      },
      {
        "source_ref": "supplied_sources[7]",
        "source_type": "regulatory_applicability_memo",
        "status": "needs_evidence",
        "issues": [
          "Illustrative or placeholder material is not documentary evidence."
        ]
      }
    ],
    "owner_actions": [
      {
        "source_type": "mining_concession_or_license_extract",
        "owner": "supplier / dossier owner",
        "priority": "before_decision",
        "action": "Supply mining concession or license extract with issuer, issue date, excerpt and matching project/commodity/origin scope; confirm authenticity and applicability with a human reviewer."
      },
      {
        "source_type": "certified_ore_assay_report",
        "owner": "supplier / dossier owner",
        "priority": "before_decision",
        "action": "Supply certified ore assay report with issuer, issue date, excerpt and matching project/commodity/origin scope; confirm authenticity and applicability with a human reviewer."
      },
      {
        "source_type": "beneficial_ownership_due_diligence",
        "owner": "supplier / dossier owner",
        "priority": "before_decision",
        "action": "Supply beneficial ownership due diligence with issuer, issue date, excerpt and matching project/commodity/origin scope; confirm authenticity and applicability with a human reviewer."
      },
      {
        "source_type": "export_quota_and_permit_clearance",
        "owner": "compliance counsel",
        "priority": "before_decision",
        "action": "Supply export quota and permit clearance with issuer, issue date, excerpt and matching project/commodity/origin scope; confirm authenticity and applicability with a human reviewer."
      },
      {
        "source_type": "responsible_sourcing_due_diligence",
        "owner": "supplier / dossier owner",
        "priority": "before_decision",
        "action": "Supply responsible sourcing due diligence with issuer, issue date, excerpt and matching project/commodity/origin scope; confirm authenticity and applicability with a human reviewer."
      },
      {
        "source_type": "processing_and_refining_tolling_agreement",
        "owner": "supplier / dossier owner",
        "priority": "before_decision",
        "action": "Supply processing and refining tolling agreement with issuer, issue date, excerpt and matching project/commodity/origin scope; confirm authenticity and applicability with a human reviewer."
      },
      {
        "source_type": "chain_of_custody_records",
        "owner": "supplier / dossier owner",
        "priority": "before_decision",